[{"connectionId":"right","principal":"synthetic-p7-right","identity":{"provider":"azure-devops","origin":"https://dev.azure.com","basePath":"","tenantId":"tenant-right","containerId":"right-guid","itemKind":"Bug","nativeId":"1"},"data":{"identity":{"provider":"azure-devops","tenantId":"cc76fcc050ffabc1871707213f6cdedc4d84b01e7dd7ee48306bcd62ad5460ae","containerId":"right-guid","remoteId":"1","itemKind":"Bug"},"nativeTenantId":"tenant-right","displayKey":"Bug 1","url":"https://dev.azure.com/acme/right/_apis/wit/workItems/1","revision":"2","revisionKind":"azure-work-item-rev","updatedAt":"","fields":{"System.Description":"captured","System.TeamProject":"right","System.Title":"base","System.WorkItemType":"Bug"},"relations":[],"comments":[],"projectFields":{},"transitions":[],"provenance":{"System.Description":[{"assetSha256":"8805d4945f51ee9809d639da8cd04d923e87f26cff7eea63bf5a7806c74683be","jsonPointer":"/value/0/fields/System.Description"}],"System.TeamProject":[{"assetSha256":"8805d4945f51ee9809d639da8cd04d923e87f26cff7eea63bf5a7806c74683be","jsonPointer":"/value/0/fields/System.TeamProject"}],"System.Title":[{"assetSha256":"8805d4945f51ee9809d639da8cd04d923e87f26cff7eea63bf5a7806c74683be","jsonPointer":"/value/0/fields/System.Title"}],"System.WorkItemType":[{"assetSha256":"8805d4945f51ee9809d639da8cd04d923e87f26cff7eea63bf5a7806c74683be","jsonPointer":"/value/0/fields/System.WorkItemType"}]},"lossyFields":[],"complete":true}}]
